date,title,summary
20260425,Comstock Resources (NYSE:CRK) Lowered to Sell Rating by Wall Street Zen,"Wall Street Zen has downgraded Comstock Resources (NYSE: CRK) from a ""hold"" to a ""sell"" rating, with a consensus ""Reduce"" rating and an average price target of $20.88 among analysts. Despite beating EPS and revenue estimates, the stock opened at $16.95, trading below its 50- and 200-day moving averages, and a VP sold shares while some institutions increased their holdings. The company reported strong Q4 2025 earnings with revenue up 115.5% year-over-year."
20260425,DTE Energy (NYSE:DTE) Rating Increased to Hold at Wall Street Zen,"Wall Street Zen has upgraded DTE Energy (NYSE:DTE) from a ""sell"" to a ""hold"" rating. The utility provider beat quarterly earnings per share and revenue expectations, and multiple brokers have raised price targets, contributing to an average analyst rating of ""Moderate Buy"" with a target price of $155.23. Institutional investors and hedge funds hold a significant portion of the company's stock, with Vanguard Group Inc., Capital Research Global Investors, and State Street Corp among those increasing their holdings."
20260424,"Cathie Wood’s ARK buys Amazon stock, sells AMD and Rocket Lab By Investing.com","Cathie Wood's ARK ETFs made significant portfolio adjustments on Friday, April 24th, 2026. The firm acquired over 4 million shares of X-Energy Inc (NASDAQ:XE) and 280,450 shares of Amazon.com Inc (NASDAQ:AMZN), continuing a trend of increasing its Amazon holdings. Conversely, ARK sold off substantial portions of Advanced Micro Devices Inc (NASDAQ:AMD), Rocket Lab Corp (NASDAQ:RKLB), Teradyne Inc (NASDAQ:TER), Caterpillar Inc (NYSE:CAT), and Iridium Communications Inc (NASDAQ:IRDM), indicating a strategic shift in its investment focus."
20260424,[Form 4] PETROBRAS - PETROLEO BRASILEIRO SA Insider Trading Activity,"Clarice Coppetti, Chief Corporate Affairs Officer of PETROBRAS - PETROLEO BRASILEIRO SA (PBR), reported updated holdings of phantom shares. These phantom shares are linked to PETR3 common shares and were credited as a result of a dividend payment on April 22, 2026, under the Petrobras Performance Award Program. The awards are settled in cash upon vesting, with deferred portions vesting in four equal annual installments, and also receive proportional credits for dividends or interest on equity."
20260424,"Brazil's Petrobras to raise jet fuel prices to distributors by 18% in May, reports Valor","Brazilian state-run oil firm Petrobras is set to increase the average price of jet fuel sold to distributors by 18% starting May 1, according to local newspaper Valor Economico. This follows a 54.8% hike in April due to rising oil prices linked to the U.S.-Israeli war on Iran, with Petrobras allowing distributors to pay the increase in installments. The company adjusts jet fuel prices monthly based on factors like oil prices and currency exchange rates."
20260424,Zeo Energy Receives Nasdaq Notice on Minimum Bid Price,"Zeo Energy (ZEO) has received a notice from Nasdaq for failing to meet the minimum $1 bid price requirement for 30 consecutive business days. The company now has a 180-day period until October 20, 2026, to regain compliance, or it risks potential delisting. TipRanks' AI Analyst, Spark, rates ZEO as ""Neutral"" due to weak financial performance, including negative cash flow, declining revenue, and widening losses."
20260424,"Weekly Market Update: Stocks Flat as Energy Rises, Healthcare Falls","The Morningstar US Market Index saw a slight rise of 0.46% for the week ending April 24, with energy and technology sectors performing best, while healthcare and communication services declined. Arm Holdings and Advanced Micro Devices were among the top stock gainers, while Charter Communications and Medpace Holdings were among the top losers. The report also highlights key economic events and earnings reports scheduled for the upcoming week."
20260424,Plug Power Stock Watch: Louisiana Hydrogen Plant Hits 90% Availability As Cash Burn Test Looms,"Plug Power’s St. Gabriel, Louisiana hydrogen facility, a joint venture with Olin, achieved 90% availability in Q1, producing 448.3 metric tons of liquid hydrogen and filling 101 trailers. This performance is crucial for Plug to demonstrate network scalability, improve margins, and reduce cash burn, especially after a positive gross margin in Q4. Despite these operational improvements, the company's stock, along with other hydrogen and fuel-cell stocks, experienced a slight dip, and Plug Power faces ongoing financial risks and hurdles as it aims for sustained profitability and efficient liquidity management."
20260424,Uranium Energy Corp (UEC) Stock Down 6.0% but Still Overvalued -- GF Score: 51/100,"Uranium Energy Corp (UEC) shares fell 6.0% to $14.05, yet the stock remains significantly overvalued with a GF Value of $1.99, indicating a 606.0% overvaluation. The company's GF Score is 51/100, highlighting strong financial strength but weak profitability and growth. Insiders have shown no recent activity, suggesting a neutral outlook on the company's immediate future."
20260424,"Suncor Energy Inc. stock falls Friday, underperforms market","Suncor Energy Inc. (SU) shares dropped 1.04% to C$87.56 on Friday, underperforming the broader Canadian market as the S&P/TSX Composite Index fell 0.03%. The company's stock closed 7.2% below its 52-week high of C$94.34, which was reached on March 30th."
20260424,Scorpio Tankers leads seven ocean transportation stocks with new Buy ratings at Jefferies,"Jefferies has initiated Buy ratings on seven marine transportation stocks, citing rising energy prices due to the war in Iran as a key driver for the sector's bullish sentiment. Among the favored stocks are International Seaways and Scorpio Tankers, noted for their strong balance sheets, strategic asset exposure, and attractive valuations. Geopolitical events are contributing to a tight supply environment, making the sector outlook appealing."
20260424,Why ConocoPhillips (COP) Stock Is Trading Lower Today,"Shares of ConocoPhillips (COP) dropped 2.9% after crude oil prices eased due to signs of de-escalation in the Middle East, specifically a three-week ceasefire extension between Israel and Lebanon and reports of potential peace talks involving Iran. This news reduced concerns about supply disruptions, leading to lower oil prices and subsequently impacting the profitability and stock value of energy companies like ConocoPhillips. The stock closed down 2.2% at $121.66."
20260424,Houston's oil field services companies see double-digit drops in Middle East revenue,"Houston's three major oil field services companies—Halliburton, SLB, and Baker Hughes—experienced significant double-digit declines in Middle East revenue during the first quarter of 2026. This downturn is primarily attributed to regional conflicts, with forecasts suggesting further revenue decreases in the second quarter if the current geopolitical situation persists."
20260424,"APA Corporation (APA) Stock Trades Down, Here Is Why","Shares of APA Corporation (APA), an oil and gas producer, fell 2.9% after crude oil prices dropped due to hopes of diplomatic progress between the US and Iran. As a result, WTI crude oil futures slipped to $94.8 per barrel, impacting APA’s financial performance which is closely tied to energy prices. This decline follows a previous drop related to a potential US-Iran ceasefire and a bearish IEA report forecasting a contraction in global oil demand."
20260424,"Brookfield Renewable Partners (TSE:BEP.UN) Stock Price Expected to Rise, Desjardins Analyst Says","Desjardins has raised its price target for Brookfield Renewable Partners (TSE:BEP.UN) from C$45.00 to C$48.00, maintaining a ""hold"" rating and suggesting a potential upside of 3.34%. Despite this positive outlook, the company faces profitability challenges with a negative net margin of 4.2% and high leverage, indicated by a debt-to-equity ratio of 107.8. Brookfield Renewable, which operates a globally diversified portfolio of clean energy assets, reported C$0.74 EPS for the quarter and has a market cap of C$14.21 billion."
20260424,A Look At National Fuel Gas (NFG) Valuation As Analyst Optimism Builds Ahead March 2026 Earnings,"National Fuel Gas (NFG) is attracting investor attention ahead of its March 2026 earnings, with analysts optimistic about its performance. The company is currently trading at $89.15, below the most-followed fair value estimate of $102, suggesting it might be undervalued based on its strong Marcellus Shale inventory and efficient production. However, a discounted cash flow model by Simply Wall St offers a lower fair value of $80.84, indicating a potential overvaluation by the market."
20260424,"Middle East Issues Hit SLB Operations, Profit","SLB reported a challenging first quarter of 2026, with revenue beating estimates but GAAP EPS decreasing due to widespread disruptions in the Middle East. Geopolitical issues led to demobilization of operations in several countries, particularly impacting Well Construction and Reservoir Performance segments. Despite these headwinds, the company saw growth in Digital revenue and Production Systems (driven by ChampionX acquisition), and advanced strategic moves including a share repurchase program, dividend approval, and an agreement to acquire S&P Global's geoscience and petroleum engineering software portfolio."
20260424,FuelCell Energy (NASDAQ:FCEL) Stock Price Down 11.2% - Here's Why,"FuelCell Energy (NASDAQ:FCEL) shares dropped 11.2% to $10.81 on Friday due to weakened analyst sentiment and mixed quarterly results. While the company beat EPS estimates, it missed revenue expectations and remains unprofitable. Analysts have a ""Reduce"" consensus rating with a target price of $8.24, with recent cuts from Jefferies and Wells Fargo."
20260424,NRG Energy Inc. stock outperforms competitors on strong trading day,"Shares of NRG Energy Inc. (NRG) increased by 3.42%, closing at $159.81 on Friday. This performance occurred during a mixed trading session where the S&P 500 Index rose, but the Dow Jones Industrial Average fell, marking NRG's second consecutive day of gains. The article highlights NRG's outperformance relative to its competitors and the broader market trends."
20260424,3 Cruise Stocks to Buy as Oil Prices Plummet,"The cruise industry, despite a recent downturn due to the US-Iran conflict impacting fuel prices and travel routes, is poised for a rebound as oil prices are expected to stabilize. This article highlights three cruise stocks—Carnival Corp. (CCL), Royal Caribbean Group (RCL), and Norwegian Cruise Line Holdings (NCLH)—as strong ""buy the dip"" opportunities for investors taking a long-term view. Positive financial outlooks, strong customer bookings, strategic fleet expansions, and analyst endorsements suggest significant upside potential for these companies once the geopolitical situation calms and fuel costs decrease."
20260424,Occidental Petroleum Corp. stock outperforms competitors despite losses on the day,"Shares of Occidental Petroleum Corp. (OXY) fell 1.23% to $57.12 on Friday, ending a four-day winning streak. This occurred despite a mixed trading session where the S&P 500 Index rose and the Dow Jones Industrial Average slightly declined. The stock's performance is presented in the context of broader market movements."
20260424,Morgan Stanley Boosts Valero Energy (NYSE:VLO) Price Target to $222.00,"Morgan Stanley increased its price target for Valero Energy (NYSE:VLO) to $222.00 from $182.00, while maintaining an ""equal weight"" rating, suggesting a potential downside of 4.87% from its current price. Although Morgan Stanley's target implies a slight downside, other firms like Wells Fargo, Goldman Sachs, BMO Capital Markets, and Scotiabank have set higher targets, contributing to a consensus ""Moderate Buy"" rating with an average target of $230.65. Valero recently surpassed quarterly EPS estimates and has an upcoming earnings report that is anticipated to be a key near-term catalyst."
20260424,Cummins stock reaches all-time high of 663.03 USD,"Cummins Inc. stock has reached an all-time high of $663.38 USD, demonstrating a 1-year total return of 127.63% and garnering a ""GREAT"" financial health score from InvestingPro. This surge reflects strong investor confidence despite being considered overvalued by InvestingPro. Recent positive news for the company includes a declared quarterly cash dividend and strong Q4 2025 earnings, leading to several analyst price target revisions."
20260424,"Pembina Pipeline Corp. stock rises Friday, outperforms market","Pembina Pipeline Corp. (PPL) stock rose by 0.19% to C$59.29 on Friday, outperforming the Canadian market as the S&P/TSX Composite Index fell by 0.03%. Despite the gain, the stock closed 7.7% below its 52-week high of C$64.27, which it reached on March 30th."
20260424,Exxon Mobil Corp. stock outperforms competitors despite losses on the day,"Exxon Mobil Corp. (XOM) shares fell by 1.08% to $148.91 on Friday, despite a mixed trading session where the S&P 500 Index rose and the Dow Jones Industrial Average declined. This loss ended a four-day winning streak for the stock."
20260424,"Algonquin Power & Utilities Corp. stock remains steady Friday, still outperforms market","Algonquin Power & Utilities Corp. (AQN) stock remained steady on Friday despite a negative trading session for the Canadian market, where the S&P/TSX Composite Index fell 0.03%. The company closed 10.6% below its 52-week high of C$9.69, which it reached on February 27th. This performance indicates that the stock still outperformed the broader market."
20260424,OGE Benefiting From Energy Demand Growth,"OGE Energy, having completed its transition to a fully regulated electric utility in late 2022, now bases its growth prospects primarily on Oklahoma rate regulation and increasing electricity demand. The company's earnings power is also supported by infrastructure investments and constructive regulatory developments, boosting investment for 2026-2029."
20260424,"Alpha Metallurgical Resources: Cyclical Opportunity, India-Linked Demand Tailwinds","Alpha Metallurgical Resources (AMR) is highlighted as the leading U.S. producer of premium coking coal, with a significant portion of its exports going to India, a growing market for metallurgical coal imports. The company is noted for its strong capital allocation strategy, including share buybacks that have reduced its share count by approximately 30%, and is seen as a buy due to favorable risk-reward prospects and demand tailwinds. The article suggests AMR offers a strong cash flow yield and potential for significant gains if met coal prices rise."
20260424,Constellation Energy vs. NextEra Energy: Which Utility Stock Wins Now?,"This article compares NextEra Energy (NEE) and Constellation Energy (CEG), two leading utility stocks, evaluating them based on earnings estimates, return on equity, dividend yield, capital investment plans, valuation, and price performance. While both companies are significant players in clean energy, the analysis concludes that NextEra Energy currently offers a stronger investment opportunity due to better earnings estimate movement, a higher dividend yield, more extensive capital investments, and a cheaper valuation. The article highlights the growing demand for clean electricity driven by AI, EVs, and industrial growth, and how both companies are investing in renewable and carbon-free technologies."
20260424,"Scotiabank Raises Chevron (CVX) Target, Sees Mixed Trends Across Energy Sector","Scotiabank increased its price target for Chevron (CVX) to $187 from $168, maintaining a Sector Perform rating, while noting mixed trends across the energy sector. The firm's outlook is generally above consensus for E&P companies but below for independent refiners. Chevron recently restored full production at its Wheatstone LNG facility in Western Australia after cyclone damage, which had temporarily taken processing trains offline."
20260424,ExxonMobil's 2025 Giving Campaign delivers record results to United Way of Greater Houston and Houston community,"ExxonMobil's 2025 Houston Giving Campaign raised a record $16 million, marking the largest fundraising total in over 60 years of community giving for the company. This amount includes contributions from employees, retirees, the ExxonMobil Foundation, and various fundraising events, showcasing the company's commitment to strengthening the Greater Houston community. Of the total, $13.3 million was directed to United Way of Greater Houston, supporting education, workforce development, and essential family services, while additional funds benefited STEM scholarships and local nonprofits."
20260424,A Look At Valaris (VAL) Valuation After Strong 1 Year Returns And Mixed Near Term Momentum,"Valaris (VAL) has shown strong returns over the past year and three months, but its near-term momentum is fading. Despite trading 37% above a fair value estimate of $65.93, driven by a large contract backlog, its current P/E ratio of 6.4x appears low compared to industry averages. Investors are presented with mixed signals regarding its valuation, urging a closer look at underlying data and risks."
20260424,Centrus Energy (LEU) Maintained by B. Riley Securities -- Price Target Lowered to $295,"B. Riley Securities has maintained a 'Buy' rating for Centrus Energy (LEU) but lowered its price target from $315.00 to $295.00. Despite the 'Buy' rating, GuruFocus indicates that LEU is significantly overvalued at 306.1% above its intrinsic value and has a moderate GF Score™ of 66/100, suggesting caution for investors due to high valuation metrics and limited insider activity."
20260424,Why Is Exxon So Afraid of NLPC’s Proposal to Split Chair and CEO?,"The National Legal and Policy Center (NLPC) is questioning Exxon Mobil's strong opposition to its shareholder proposal which seeks to split the roles of Chair and CEO. NLPC criticizes Exxon's proxy statement for labeling the proposal a ""zombie"" and the NLPC as a ""serial proponent,"" arguing that Exxon's current CEO, Darren Woods, has made questionable strategic decisions and cultivated an adversarial relationship with a pro-hydrocarbon administration. The article suggests that Exxon's defensive rhetoric indicates the importance of passing the proposal, aligning with a growing corporate governance norm where 60% of S&P 500 companies separate these roles."
20260424,SLB rises following in-line Q1; to acquire S&P Global’s subsurface oil software business (SLB:NYSE),"SLB (NYSE:SLB) shares rose 1.9% after the company reported Q1 adjusted earnings that matched analyst expectations, despite a year-over-year decline attributed to disruptions in the Middle East. The oilfield services giant also announced its intention to acquire S&P Global's subsurface oil software business, a move expected to enhance its technology and competitiveness, particularly in the U.S. shale market. SLB anticipates crude prices will remain elevated even after the resolution of the Middle East conflict."
20260424,Constellation Energy vs. NextEra Energy: Which Utility Stock Wins Now?,"This article compares NextEra Energy (NEE) and Constellation Energy (CEG), two utility stocks in the Electric Power industry, to determine which offers a stronger investment opportunity. Both companies are investing heavily in clean energy, with NEE focusing on wind and solar and CEG on nuclear power. While both are rated ""Hold"" by Zacks, NEE is presented as having an edge due to better price performance, earnings estimate movement, dividend yield, capital investment plans, and a slightly cheaper valuation."
20260424,ExxonMobil’s Darren Woods: The Case for an Independent Chair,"The National Legal and Policy Center (NLPC) is urging ExxonMobil shareholders to vote for a proposal to separate the roles of Chairman and CEO, currently held by Darren Woods. The NLPC cites Woods's public stances on the Paris Agreement and Venezuela, which have led to significant financial setbacks and political friction, as reasons for needing an independent board chair. They also note that 60% of S&P 500 companies have already adopted this separation, and BlackRock, ExxonMobil's second-largest shareholder, had previously supported such a split."
20260424,Royal Bank Of Canada Forecasts Strong Price Appreciation for Patterson-UTI Energy (NASDAQ:PTEN) Stock,"Royal Bank of Canada has increased its price target for Patterson-UTI Energy (NASDAQ:PTEN) stock from $12 to $14, maintaining an ""outperform"" rating and implying a 23% upside. This follows the company's Q1 results beating revenue and EPS estimates, and a declared quarterly dividend of $0.10. Despite these positive indicators, PTEN faces challenges including a 12.7% year-over-year revenue decline, negative net margin and ROE, and projected negative full-year EPS, indicating continued profitability concerns."
20260424,Alliance Resource earnings on deck: Coal prices weigh on outlook By Investing.com,"Alliance Resource Partners LP is scheduled to report first-quarter earnings, with analysts anticipating a significant drop in profits due to challenging coal prices. Investors will be closely watching for signs of operational efficiency improvements and updates on the Mettiki mine's future to offset pricing headwinds. Despite a challenging environment, two analysts rate the stock a Strong Buy, suggesting potential upside."
20260424,Earnings Preview: Imperial Oil (IMO) Q1 Earnings Expected to Decline,"Imperial Oil (IMO) is expected to report a year-over-year decline in Q1 earnings despite higher revenues, with the report anticipated on May 1st. While the consensus EPS estimate has seen a significant upward revision recently, the company's Earnings ESP of 0% combined with a Zacks Rank #1 makes it difficult to conclusively predict an earnings beat. Historically, Imperial Oil has consistently beaten EPS estimates, doing so four times in the last four quarters."
20260424,Chevron CEO Expects Air Travel To 'Get Worse' Over The Next Few Weeks As Hormuz Crisis Pushes Fuel Costs Higher,"Chevron CEO Mike Wirth predicts a worsening situation for air travel in the coming weeks due to the Hormuz crisis, leading to higher fuel costs and reduced flight availability. He notes that the jet fuel market is tightening, particularly in Europe and Asia, and North American jet fuel prices have surged over 80% year-on-year. Wirth also highlighted that U.S. airlines are relatively better off than their European counterparts as the U.S. produces its own jet fuel."
20260424,U S Global Investors Inc. Takes $1.12 Million Position in Viking Holdings Ltd. $VIK,"U S Global Investors Inc. has acquired a new position in Viking Holdings Ltd. (NYSE:VIK), purchasing 15,700 shares valued at approximately $1.12 million in the fourth quarter. This acquisition highlights the strong institutional interest in Viking, with institutional investors and hedge funds now owning 98.84% of the company. Viking Holdings currently holds a ""Moderate Buy"" consensus rating from analysts, with an average price target of $79.93."
20260424,Earnings Preview: Dominion Energy (D) Q1 Earnings Expected to Decline,"Dominion Energy (D) is projected to report a year-over-year decline in Q1 earnings, despite an expected increase in revenue. The Zacks Consensus Estimate for EPS is $0.89, a 4.3% decrease, with revenues forecast at $4.25 billion, up 4.3%. The company's Earnings ESP is negative, making an earnings beat difficult to predict conclusively, although it has historically surpassed EPS estimates."
20260424,APA (APA) Rallied Following the Surge in Oil Prices,"APA Corporation (APA) saw a rally in its stock price, contributing significantly to the Hotchkis & Wiley Mid-Cap Value Fund's outperformance in Q1 2026. This surge was primarily driven by rising oil prices, fueled by geopolitical instability from the U.S.-Israel strikes on Iran and the Strait of Hormuz closure. The company's undervalued status and beneficial natural gas financial contracts also played a role in its strong performance."
20260424,APA (APA) Rallied Following the Surge in Oil Prices,"APA Corporation (APA) saw its shares rally due to a surge in oil prices, driven by geopolitical instability and US-Israel strikes on Iran. This performance was highlighted in Hotchkis & Wiley Mid-Cap Value Fund's Q1 2026 investor letter, which noted the company's strong contributions to the fund's outperformance. Despite this, the firm emphasizes that other AI stocks might offer better short-term returns and higher upside potential."
20260424,U S Global Investors Inc. Trims Stake in Allegiant Travel Company $ALGT,"U S Global Investors Inc. reduced its stake in Allegiant Travel Company by 25.2% during the fourth quarter, selling 95,993 shares and ending with 284,685 shares valued at approximately $24.3 million. This makes Allegiant its fifth-largest holding. Meanwhile, company insiders, including Chairman Maurice J. Gallagher Jr., have been net sellers, with over 300,000 shares sold in the past 90 days, though insiders still own 14.7% of the company. Analyst ratings are mixed, with a consensus ""Hold"" and an average price target of $97.91, while the stock currently trades around $78.74."
20260424,Jet fuel climbs above $3.80 a gallon as XCF makes its SAF case,"XCF Global's CEO, Chris Cooper, was featured on Water Tower Research's Small-Cap Spotlight podcast, discussing the company's strategy for advancing Sustainable Aviation Fuel (SAF) production. This comes as U.S. jet fuel prices have surged above $3.80 per gallon, highlighting the urgent need for domestic, alternative fuels. XCF Global aims to convert non-food waste into SAF at its New Rise Reno facility, potentially reducing greenhouse gas emissions by up to 80%."
