date,title,summary
20260424,Is Teradyne Inc (TER) Overvalued After 4.3% Rally? GF Value Says,"Teradyne Inc (TER) shares recently rallied 4.3%, contributing to a significant 442.9% increase over the past year. Despite this strong performance, GuruFocus' GF Value™ indicates the stock is 195.2% overvalued at $418.08 against a fair value of $141.62. This overvaluation is further supported by a P/E ratio of 120.1x, well above its 5-year median, and recent insider selling, suggesting potential risks for investors."
20260424,Uranium Energy Corp (UEC) Stock Down 6.0% but Still Overvalued -- GF Score: 51/100,"Uranium Energy Corp (UEC) shares fell 6.0% to $14.05, yet the stock remains significantly overvalued with a GF Value of $1.99, indicating a 606.0% overvaluation. The company's GF Score is 51/100, highlighting strong financial strength but weak profitability and growth. Insiders have shown no recent activity, suggesting a neutral outlook on the company's immediate future."
20260424,A Look At Stride (LRN) Valuation After Ceasefire Relief And Strong Earnings Performance,"Stride (LRN) experienced an afternoon rally due to reduced geopolitical risk from an Iran ceasefire extension and strong earnings performance. While its current valuation narrative suggests it's 92.9% overvalued with a fair value of $51 against a $98.36 share price, its low 13x P/E ratio appears undervalued compared to the Consumer Services industry. The company's value proposition is tied to skills-based education beyond K-12, focusing on recurring demand for career-aligned programs and efficient scaling."
20260424,"Stock Market Today: SPY, QQQ Power to Record Highs ahead of Potential U.S.-Iran Talks in Islamabad","U.S. equities, including the S&P 500 ETF (SPY) and Nasdaq 100 ETF (QQQ), reached record highs on Friday. This surge occurred amidst news of potential U.S.-Iran negotiations, with special envoys dispatched to Islamabad, despite Iran denying intentions for direct talks. Several companies like Intel and AMD also saw significant gains following positive earnings and analyst upgrades."
20260424,Freeport-McMoRan vs Ero Copper: Which Stock Could Rally?,"This article compares Freeport-McMoRan (FCX) and Ero Copper (ERO) stocks, suggesting ERO offers superior revenue growth, profitability, and valuation. ERO outperformed FCX in quarterly and last 12 months revenue growth, and also showed better operating margins and historical market performance. The analysis highlights key financial metrics and historical data to support the recommendation for ERO."
20260424,JPMorgan Chase & Co. Issues Pessimistic Forecast for Tractor Supply (NASDAQ:TSCO) Stock Price,"JPMorgan Chase & Co. has lowered its price target for Tractor Supply (TSCO) from $55.00 to $48.00, maintaining a ""neutral"" rating, following the company's miss on Q1 earnings and revenue expectations. Several other firms also trimmed their price targets, contributing to a ""Moderate Buy"" average rating with a $49.08 target. Tractor Supply's stock experienced a selloff, hitting a one-year low, amid these analyst adjustments and recent insider selling activity totaling approximately $12 million."
20260424,"APA Corporation (APA) Stock Trades Down, Here Is Why","Shares of APA Corporation (APA), an oil and gas producer, fell 2.9% after crude oil prices dropped due to hopes of diplomatic progress between the US and Iran. As a result, WTI crude oil futures slipped to $94.8 per barrel, impacting APA’s financial performance which is closely tied to energy prices. This decline follows a previous drop related to a potential US-Iran ceasefire and a bearish IEA report forecasting a contraction in global oil demand."
20260424,Commodity Prices Are Soaring Again. Here Are 3 ETFs to Ride the Trend,"With inflation stubbornly above the Fed's target and significant volatility in energy prices, commodities are gaining investor interest. This article highlights three ETFs that offer distinct ways to gain exposure to the rising commodity prices: Invesco DB Agriculture Fund (DBA) for pure agricultural futures, WisdomTree Enhanced Commodity Strategy Fund (GCC) for broad, actively managed commodity exposure, and SPDR S&P Metals & Mining ETF (XME) for equity exposure to U.S. metals and mining companies. Each ETF caters to different investment objectives and tax considerations."
20260424,Nomura (NYSE:NMR) Trading Down 6.1% - Here's Why,"Nomura (NYSE:NMR) shares dropped 6.1% on Friday, trading at $7.765 with significantly reduced volume. This decline followed the company's Q4 earnings report, which missed EPS estimates ($0.18 vs. $0.24 expected) but beat revenue expectations ($3.52B vs. $3.25B). Despite mixed analyst sentiment, with a consensus ""Buy"" rating and a recent upgrade by JPMorgan Chase & Co., the stock trades at a P/E of 9.91 and has a high debt-to-equity ratio of 7.54."
20260424,"Power Integrations and Teradyne Stocks Trade Up, What You Need To Know","Power Integrations and Teradyne stocks rose following strong earnings from Intel and positive forecasts for the semiconductor sector. Intel's 22% growth in its data center business, driven by AI demand, boosted confidence across the industry, leading to gains for companies like AMD, Qualcomm, and ARM. Additionally, a research firm raised its semiconductor revenue forecast for 2026 due to surging AI-related demand, further fueling the market rally."
20260424,How Investors Are Reacting To Clorox (CLX) Earnings Beat Amid Revenue Dip And Cost Pressures,"The Clorox Company recently released its Q3 fiscal 2026 results, showing improved earnings despite a slight revenue decline and ongoing cost and demand pressures. The company is relying on its IGNITE strategy and cost-saving initiatives to manage margins, while also reaffirming its FY2026 guidance and continuing share repurchases. Investors are evaluating how persistent cost inflation and competitive pressures will impact Clorox's future performance and an expected 23% upside to its fair value."
20260424,Financial Markets Morning Commentary,"This morning commentary highlights mixed movements in financial markets: stocks are up due to favorable Intel earnings and calm oil prices amidst diplomatic efforts regarding Iran. Geopolitical tensions, particularly the Iran war, continue to influence commodity prices, interest rate discussions by central banks globally, and corporate profit outlooks from companies like Procter & Gamble and SLB."
20260424,3 Cruise Stocks to Buy as Oil Prices Plummet,"The cruise industry, despite a recent downturn due to the US-Iran conflict impacting fuel prices and travel routes, is poised for a rebound as oil prices are expected to stabilize. This article highlights three cruise stocks—Carnival Corp. (CCL), Royal Caribbean Group (RCL), and Norwegian Cruise Line Holdings (NCLH)—as strong ""buy the dip"" opportunities for investors taking a long-term view. Positive financial outlooks, strong customer bookings, strategic fleet expansions, and analyst endorsements suggest significant upside potential for these companies once the geopolitical situation calms and fuel costs decrease."
20260424,Cummins stock reaches all-time high of 663.03 USD,"Cummins Inc. stock has reached an all-time high of $663.38 USD, demonstrating a 1-year total return of 127.63% and garnering a ""GREAT"" financial health score from InvestingPro. This surge reflects strong investor confidence despite being considered overvalued by InvestingPro. Recent positive news for the company includes a declared quarterly cash dividend and strong Q4 2025 earnings, leading to several analyst price target revisions."
20260424,"Alpha Metallurgical Resources: Cyclical Opportunity, India-Linked Demand Tailwinds","Alpha Metallurgical Resources (AMR) is highlighted as the leading U.S. producer of premium coking coal, with a significant portion of its exports going to India, a growing market for metallurgical coal imports. The company is noted for its strong capital allocation strategy, including share buybacks that have reduced its share count by approximately 30%, and is seen as a buy due to favorable risk-reward prospects and demand tailwinds. The article suggests AMR offers a strong cash flow yield and potential for significant gains if met coal prices rise."
20260424,Constellation Energy vs. NextEra Energy: Which Utility Stock Wins Now?,"This article compares NextEra Energy (NEE) and Constellation Energy (CEG), two leading utility stocks, evaluating them based on earnings estimates, return on equity, dividend yield, capital investment plans, valuation, and price performance. While both companies are significant players in clean energy, the analysis concludes that NextEra Energy currently offers a stronger investment opportunity due to better earnings estimate movement, a higher dividend yield, more extensive capital investments, and a cheaper valuation. The article highlights the growing demand for clean electricity driven by AI, EVs, and industrial growth, and how both companies are investing in renewable and carbon-free technologies."
20260424,"Scotiabank Raises Chevron (CVX) Target, Sees Mixed Trends Across Energy Sector","Scotiabank increased its price target for Chevron (CVX) to $187 from $168, maintaining a Sector Perform rating, while noting mixed trends across the energy sector. The firm's outlook is generally above consensus for E&P companies but below for independent refiners. Chevron recently restored full production at its Wheatstone LNG facility in Western Australia after cyclone damage, which had temporarily taken processing trains offline."
20260424,Rogers stock hits 52-week high at 132.06 USD By Investing.com,"Rogers Corp stock has reached a new 52-week high of $132.06, reflecting a significant 128.24% increase in value over the past year. The stock is currently trading slightly above its InvestingPro Fair Value, placing it on the overvalued watchlist. The company recently reported strong fourth-quarter earnings, surpassing analyst expectations, and announced the upcoming departure of a senior executive."
20260424,"Ellington Financial Earnings, Book Value, and Price-to-Book Analysis | 2026 Update - News and Statistics","Ellington Financial's stock has shown modest growth over the past six months, underperforming the S&P 500, with analysts citing concerns over its diminishing profitability despite revenue growth. The company's tangible book value per share has declined, and future projected growth is considered inadequate. Currently trading at 0.9 times forward price-to-book, analysts suggest looking at other investment opportunities due to the valuation already pricing in much positive expectation."
20260424,The Coca-Cola Company (KO): Investors Hedge Against Economic Volatility,"Investors are increasingly turning to The Coca-Cola Company (KO) as a defensive play against current geopolitical and economic uncertainties. The company is valued for its ability to maintain pricing power amid inflation and its consistent dividend increases, making it an attractive low-beta option compared to more volatile tech stocks. Despite this, some believe AI stocks offer greater upside potential, suggesting a diversified approach for investors."
20260424,Here's Why Steel Dynamics Stock Spiked This Week and How That Could Continue,"Steel Dynamics (NASDAQ: STLD) stock jumped 10.6% this week after reporting record quarterly shipments and an 84% increase in net income, driven by high mill utilization rates and strong pricing. This performance contrasts with competitor Cleveland-Cliffs, which faced unfavorable pricing. Investors are now watching Nucor's upcoming earnings report for further insights into the steel market's strength, which could continue to influence Steel Dynamics' stock favorably."
20260424,Truist Financial Forecasts Strong Price Appreciation for Intel (NASDAQ:INTC) Stock,"Truist Financial has increased its price target for Intel (NASDAQ:INTC) stock from $49 to $81, maintaining a ""hold"" rating, following Intel's robust Q1 earnings beat and optimistic guidance, including a significant validation from Tesla for its 14A foundry process. This move comes as Intel's shares surged approximately 22.8% to $82, though the stock still carries a consensus ""Hold"" rating with an average target of $70.98 among analysts. Despite the positive sentiment driven by AI-related demand, valuation concerns and broader macroeconomic risks continue to draw skepticism from some financial firms."
20260424,Chevron CEO Expects Air Travel To 'Get Worse' Over The Next Few Weeks As Hormuz Crisis Pushes Fuel Costs Higher,"Chevron CEO Mike Wirth predicts a worsening situation for air travel in the coming weeks due to the Hormuz crisis, leading to higher fuel costs and reduced flight availability. He notes that the jet fuel market is tightening, particularly in Europe and Asia, and North American jet fuel prices have surged over 80% year-on-year. Wirth also highlighted that U.S. airlines are relatively better off than their European counterparts as the U.S. produces its own jet fuel."
20260424,U S Global Investors Inc. Takes $1.12 Million Position in Viking Holdings Ltd. $VIK,"U S Global Investors Inc. has acquired a new position in Viking Holdings Ltd. (NYSE:VIK), purchasing 15,700 shares valued at approximately $1.12 million in the fourth quarter. This acquisition highlights the strong institutional interest in Viking, with institutional investors and hedge funds now owning 98.84% of the company. Viking Holdings currently holds a ""Moderate Buy"" consensus rating from analysts, with an average price target of $79.93."
20260424,Monolithic Power Systems stock reaches all-time high at 1635.43 USD By Investing.com,"Monolithic Power Systems (MPWR) stock has hit an all-time high of $1,635.43, marking a 178.36% increase over the past year. The semiconductor company's market capitalization stands at $79.81 billion, and it reported strong Q4 2025 earnings and revenue, leading several analyst firms to raise their price targets. Despite being considered overvalued by some InvestingPro analysis, investor confidence in its growth and market position remains high."
20260424,APA (APA) Rallied Following the Surge in Oil Prices,"APA Corporation (APA) saw a rally in its stock price, contributing significantly to the Hotchkis & Wiley Mid-Cap Value Fund's outperformance in Q1 2026. This surge was primarily driven by rising oil prices, fueled by geopolitical instability from the U.S.-Israel strikes on Iran and the Strait of Hormuz closure. The company's undervalued status and beneficial natural gas financial contracts also played a role in its strong performance."
20260424,APA (APA) Rallied Following the Surge in Oil Prices,"APA Corporation (APA) saw its shares rally due to a surge in oil prices, driven by geopolitical instability and US-Israel strikes on Iran. This performance was highlighted in Hotchkis & Wiley Mid-Cap Value Fund's Q1 2026 investor letter, which noted the company's strong contributions to the fund's outperformance. Despite this, the firm emphasizes that other AI stocks might offer better short-term returns and higher upside potential."
20260424,Norwegian Cruise Line Stock Is Down 22% in 6 Months: Can It Reach $26 by 2017?,"Norwegian Cruise Line Holdings (NCLH) has faced pressure due to investor concerns over high debt, fuel costs, and slower profit growth, despite improved revenue in 2025. A valuation model projects NCLH stock could reach $26 per share by December 2030, representing a 42.2% total return and 7.8% annualized return from its current price of $18, assuming stable demand, improved margins, and reduced leverage. The company is actively addressing these issues through board refreshment, capacity growth initiatives, and efforts to improve profitability while managing its capital structure."
20260424,Why Are Stocks at Record Highs with no Iran Resolution?,"Despite ongoing geopolitical tensions in the Middle East and a naval blockade, global equities, particularly in the U.S. tech sector, have experienced a rapid recovery, with the S&P 500 nearing all-time highs. This swift rebound, faster than historical recoveries, is driven less by a clear resolution to the conflict and more by durable earnings fundamentals. Corporate earnings are consistently beating Wall Street expectations, reinforcing investor confidence in the underlying strength of the market and the tech sector."
20260424,Halliburton Q1 2026: $5.4B Revenue Holds as Middle East Conflict Dents EPS,"Halliburton reported Q1 2026 revenue of $5.4 billion, flat year-over-year, with EPS of $0.55, down 8% due to a $0.02-$0.03 impact from the Middle East conflict. International revenue, particularly Latin America and Europe-Africa, provided a bright spot, while North America and the Middle East/Asia regions saw declines. The company faces margin compression and anticipates continued Middle East conflict impact of $0.07-$0.09 per share in Q2."
20260424,TFPM: 2026 Metal Price Assumptions Will Drive Future Cash Flow Upside,"Analyst commentary has led to raised price targets for Triple Flag Precious Metals (TFPM), primarily due to updated metal price forecasts and revised P/E multiple assumptions. Despite a slight decrease in the Canadian dollar fair value estimate, the company's revenue growth assumption has increased, and profit margins are expected to improve. The analysis highlights both bullish sentiment from higher valuation models and bearish concerns regarding forecast risk tied to future metal prices and market willingness to pay for earnings."
20260424,"Markets in Context: Noise vs. Fundamentals - WisdomTree, Inc. - Commentaries","This article argues that despite prevailing geopolitical tensions and market volatility, underlying market fundamentals remain strong. Valuations are reasonable, earnings are robust, especially in technology, and the macro environment is more stable than anticipated, supported by resilient consumers and contained credit risks. Investors are advised to look beyond short-term noise and focus on long-term opportunities inherent in these constructive market conditions."
20260424,Liquidity Mapping Around (WGO) Price Events,"This article from Stock Traders Daily discusses liquidity mapping around Winnebago Industries Inc. (WGO) price events, based on AI model analysis. It identifies a near-term neutral sentiment amidst mid and long-term strength, with elevated downside risk. The report also provides institutional trading strategies including long, breakout, and short positions with specific entry, target, and stop-loss zones."
20260424,Hertz Global Holdings (HTZ): Bill Ackman Is Bullish on This Stock,"Bill Ackman's Pershing Square has shown bullish sentiment towards Hertz Global Holdings (HTZ), consistently increasing its stake in the company since Q4 2024. Despite its past costly ventures into EVs, Hertz is now liquidating them and focusing on ICE vehicles to stabilize margins, alongside forming a new strategic alliance with T-Mobile. However, the author suggests that certain AI stocks may offer greater and quicker returns than HTZ."
20260424,Jefferies (NYSE: JEF) prices $1.1B 5.125% 2031 senior notes,"Jefferies Financial Group Inc. (NYSE: JEF) has priced a public offering of $1.1 billion aggregate principal amount of 5.125% Senior Notes due 2031 with an effective yield of 5.304%. The offering is expected to settle on April 28, 2026, and the net proceeds will be used for general corporate purposes. This dilutive transaction secures fixed-rate financing until the notes mature on April 28, 2031."
20260424,Future of Solar Panel Market 2026 | Market is set to reach US$ 901.9,"The global solar panel market is projected to reach US$ 901.9 million by 2033, growing at an 18.5% CAGR from US$ 274.8 million in 2025, driven primarily by the Asia Pacific region. Key factors include net-zero targets, falling module costs, technological advancements, government incentives, and the expansion of utility-scale projects. Major players like Jinko Solar, Trina Solar, and Canadian Solar are leading this growth with innovations and strategic expansions."
20260424,"P&G Beats Expectations, Projects $150 Million of Commodity Costs","Procter & Gamble Co. exceeded analyst expectations in its latest quarter, with organic sales rising 3%. However, the company cautioned that increasing oil prices, attributed to the conflict in the Middle East, could result in up to $1 billion in added commodity costs for the upcoming fiscal year."
20260424,The Coca-Cola Company (KO): Investors Hedge Against Economic Volatility,"Amidst geopolitical and economic volatility in early 2026, smart money investors are positioning themselves in defensive stocks like The Coca-Cola Company (NYSE:KO). The firm's ability to maintain pricing power, consistent dividend increases, and low beta make it an attractive hedge. While acknowledging KO's potential, the article suggests that some AI stocks might offer higher returns in a shorter timeframe."
20260424,The Most Overlooked Commodity Supply Shock Of 2026,"The article highlights that aluminum is facing the largest supply shock in the base metals market since 2000, driven by disruptions in the Gulf region and an energy bottleneck making new capacity difficult to build. While China benefits from increased exports, Canada emerges as a strategic option for Western buyers due to its reliable, low-carbon hydro-powered production. Both Europe and the U.S. are vulnerable, relying heavily on imports as domestic production declines due to power costs and competition from AI infrastructure."
20260424,"Vaalco Energy (NYSE: EGY) 2026 proxy on director votes, pay and LTIP changes","Vaalco Energy is soliciting proxies for its 2026 Annual Meeting on June 4, 2026, where shareholders will vote on electing five directors, ratifying KPMG as auditor, an advisory say-on-pay resolution, and amending the 2020 Long Term Incentive Plan. The company highlights its 2025 performance, including $236 million in capital spending, $26.5 million in dividends, 43.0 MMBOE in year-end net reserves, and a new $255 million reserves-based lending facility, while emphasizing ESG oversight and strong corporate governance."
20260424,"Merit Financial Group LLC Sells 4,395 Shares of Cheniere Energy, Inc. $LNG","Merit Financial Group LLC reduced its stake in Cheniere Energy (NYSE:LNG) by 42.7% in Q4, selling 4,395 shares and retaining 5,902 shares valued at approximately $1.147 million. Several company insiders also sold significant shares in late March. Despite these sales, Cheniere Energy announced a $10 billion share buyback program, reported strong quarterly earnings, and maintains a ""Moderate Buy"" consensus analyst rating with a target price of $295.56."
20260424,"The Zacks Analyst Blog Archer-Daniels-Midland, Exxon Mobil, Chevron, Westinghouse Air Brake Technologies and Cummins","This Zacks Analyst Blog highlights five ""old economy"" stocks—Archer-Daniels-Midland Co. (ADM), Exxon Mobil Corp. (XOM), Chevron Corp. (CVX), Westinghouse Air Brake Technologies Corp. (WAB), and Cummins Inc. (CMI)—that have performed strongly in 2026 and are expected to continue their growth. Each company is discussed with their respective Zacks Rank (#1 Strong Buy or #2 Buy), current year revenue and earnings growth rates, and key business drivers. The blog emphasizes that despite the AI-driven market, these cyclical stocks offer diversification and continued upside potential."
20260424,Dogecoin Price Prediction as DOGE ETF Inflows Stall,"Dogecoin's price has stagnated and is near its lowest point this year, driven by flagging DOGE ETF inflows and a bearish ""head-and-shoulders"" chart pattern. The article highlights the poor performance of spot Dogecoin ETFs compared to Bitcoin and Ethereum funds, attributing it to investor skepticism towards meme coins, higher fees, and broader macro factors like geopolitical events. The report suggests a potential further price decline for DOGE, with technical indicators and a decrease in futures market demand reinforcing a bearish outlook."
20260424,U.S. Shale E&P Q4 Earnings: Matador Resources (NYSE:MTDR) is the Best in the Biz,"Matador Resources (NYSE:MTDR) led U.S. shale E&P stocks in Q4 earnings, reporting revenues of $848 million, which significantly beat analyst expectations, and saw its stock rise by 21.3% since the report. Other companies like Cactus (NYSE:WHD) and Chord Energy (NASDAQ:CHRD) also had strong quarters, while HighPeak Energy (NASDAQ:HPK) had a softer performance despite beating revenue estimates. The article also touches on market shifts from AI disruption fears to geopolitical risks impacting oil supply and inflation."
20260424,Wisconsin Energy Corporation Stock Price: A Full Guide to WEC,"This guide provides a comprehensive overview of WEC Energy Group (NYSE: WEC), focusing on its stock price, financial performance, and market outlook. It details the company's role as a major American energy holding company within the regulated utilities sector, its consistent dividend policy, and its long-term stock appreciation. The article also touches upon key financial metrics, analyst forecasts, and comparative industry analysis, highlighting WEC's stability and appeal to income-focused investors."
20260424,3 Reasons Investors Love SM Energy (SM),"SM Energy (SM) has seen a significant 40.9% jump in its stock price over the past six months. The article highlights three key reasons for investor enthusiasm: exceptional sales growth of 22.9% CAGR over five years, an elite gross margin averaging 88.3% over the last five years, and an excellent free cash flow margin averaging 20% over the same period. These factors indicate strong momentum, a robust business model, and significant reinvestment potential for the company."
