date,title,summary
20260424,Archer Daniels Midland (ADM) Stock Sinks As Market Gains: What You Should Know,"Archer Daniels Midland (ADM) stock recently declined by 1.14%, contrasting with broader market gains. The company is set to release its Q1 2026 earnings on May 5, with analysts projecting a 4.29% year-over-year EPS decrease but a 4.62% revenue increase. Despite recent stock underperformance, ADM holds a Zacks Rank #2 (Buy) and its valuation metrics suggest a premium compared to its industry."
20260424,"Weekly Market Update: Stocks Flat as Energy Rises, Healthcare Falls","The Morningstar US Market Index saw a slight rise of 0.46% for the week ending April 24, with energy and technology sectors performing best, while healthcare and communication services declined. Arm Holdings and Advanced Micro Devices were among the top stock gainers, while Charter Communications and Medpace Holdings were among the top losers. The report also highlights key economic events and earnings reports scheduled for the upcoming week."
20260424,Plug Power Stock Watch: Louisiana Hydrogen Plant Hits 90% Availability As Cash Burn Test Looms,"Plug Power’s St. Gabriel, Louisiana hydrogen facility, a joint venture with Olin, achieved 90% availability in Q1, producing 448.3 metric tons of liquid hydrogen and filling 101 trailers. This performance is crucial for Plug to demonstrate network scalability, improve margins, and reduce cash burn, especially after a positive gross margin in Q4. Despite these operational improvements, the company's stock, along with other hydrogen and fuel-cell stocks, experienced a slight dip, and Plug Power faces ongoing financial risks and hurdles as it aims for sustained profitability and efficient liquidity management."
20260424,Is Visteon Corp (VC) Overvalued After 4.1% Rally? GF Value Says,"Visteon Corp (VC) shares rallied 4.1% to $113.69 but are considered overvalued by GuruFocus' GF Value estimate of $108.47. Despite a strong GF Score of 89/100 and a P/E ratio below its historical median, insider selling worth $4.6 million in the last three months suggests caution for potential investors. The analysis indicates a limited margin of safety due to the current price exceeding its intrinsic value."
20260424,Uranium Energy Corp (UEC) Stock Down 6.0% but Still Overvalued -- GF Score: 51/100,"Uranium Energy Corp (UEC) shares fell 6.0% to $14.05, yet the stock remains significantly overvalued with a GF Value of $1.99, indicating a 606.0% overvaluation. The company's GF Score is 51/100, highlighting strong financial strength but weak profitability and growth. Insiders have shown no recent activity, suggesting a neutral outlook on the company's immediate future."
20260424,Verizon Communications (NYSE:VZ) Trading Down 1.6% - Time to Sell?,"Verizon Communications (NYSE:VZ) saw its shares drop by 1.6% on Friday, trading at $46.46 with below-average volume, signaling weak short-term technicals ahead of its Q1 earnings report. Despite increasing its quarterly dividend to yield approximately 6.1% and making strategic moves in 5G expansion and legal victories against competitors, analysts remain cautious due to wireless revenue pressure and intense competition. The company's Q1 earnings are scheduled for April 27th, which will likely dictate its near-term stock performance."
20260424,How Investors Are Reacting To Realty Income (O) Extending Its Long Dividend Streak Amid Net Lease Optimism,"Realty Income Corporation (O) has declared its 670th consecutive monthly dividend, reinforcing its reputation as a consistent income producer. The article discusses Barclays' ""Goldilocks"" view on net lease REITs, Realty Income's reliable income while highlighting potential challenges like acquisition funding, increasing European market exposure, and associated foreign currency and regulatory risks. Despite some varied fair value estimates among investors, the company's strong dividend and strategic partnerships like the Apollo joint venture continue to shape its investment narrative."
20260424,"Baidu Inc (BIDU) Stock Price, Trades & News","This GuruFocus article provides a comprehensive overview of Baidu Inc (BIDU), including its current stock price, key financial metrics, business description, and various performance indicators. It highlights both financial strengths and potential warning signs, alongside upcoming earnings dates and recent news and press releases related to the company. The article also lists analyst commentary and other related news headlines."
20260424,How Investors Are Reacting To Roper Technologies (ROP) Earnings Expectations And Segment-Level Revenue Growth,"Roper Technologies (ROP) analysts expect quarterly earnings of US$4.97 per share, up 4% year-over-year, and revenues of US$2.05 billion, an 8.9% increase, with growth across its Application Software and Technology Enabled Products segments. The company's new US$3,500 million unsecured credit facility supports its acquisition strategy to fund growth in these segments. Despite encouraging revenue forecasts, increased debt and ongoing M&A activity introduce execution risks for investors."
20260424,Keurig Dr Pepper Inc. stock outperforms competitors on strong trading day,"Keurig Dr Pepper Inc. (KDP) shares rose 2.42% to $29.22 on Friday, outperforming competitors and extending its gains for the third consecutive day. This occurred during a mixed trading session where the S&P 500 Index increased by 0.80% and the Dow Jones Industrial Average fell by 0.16%."
20260424,IPG Photonics (IPGP) Price Forecast: Breakout Setup Ahead of Earnings,"IPG Photonics (IPGP) is showing a potential breakout setup ahead of its 1Q 2026 earnings report on May 6. The stock has completed a Fibonacci retracement and formed a double bottom pattern, with increasing demand indicated by weekly performance and volume. An upside breakout above $131.20 could lead to targets near $169.41 and $186.71, aligning with a broader long-term bullish reversal signal."
20260424,Why United Rentals Shares Are Trading Higher By Around 15%; Here Are 20 Stocks Moving Premarket,"United Rentals Inc. (NYSE: URI) saw its shares climb by 15% premarket after reporting better-than-expected Q1 financial results and raising its FY26 sales guidance. The article also lists other stocks experiencing significant premarket movements, including gainers like Pineapple Financial Inc. and Quantumscape Corp., and losers such as ASGN Inc. and ServiceNow Inc. due to various company-specific news and financial reports."
20260424,BlackRock reports 39.8M shares of Kosmos Energy (NYSE: KOS) in 13G/A,"BlackRock, Inc. has filed an amended Schedule 13G/A, disclosing beneficial ownership of 39,807,154 shares (6.7%) of Kosmos Energy Ltd. (NYSE: KOS). The filing indicates that BlackRock holds sole voting power over 39,190,938 shares. This disclosure, dated April 24, 2026, is a standard reporting for large asset managers and does not include details on acquisition methods or transaction prices."
20260424,"Stock Market Today: S&P 500 Sector Leaders and Losers, 4/24/26","On Friday, April 24, 2026, the S&P 500 reached a new all-time high driven by optimism over US-Iran peace talks. The information technology sector led the gains, largely due to Intel's blowout earnings, while the healthcare sector saw the biggest decline as investors shifted towards higher-risk assets."
20260424,What's Going On With Accenture Stock Today?,"Accenture (NYSE: ACN) shares fell 7.14% after the company announced an investment in Iridius to enhance AI compliance solutions for the life sciences sector. Despite this strategic move, Accenture's stock is trading near its 52-week low and is experiencing bearish sentiment, although its quality ranking remains strong. The company's next financial update is expected on June 22, with analysts providing a consensus ""Buy"" rating."
20260424,"Suncor Energy Inc. stock falls Friday, underperforms market","Suncor Energy Inc. (SU) shares dropped 1.04% to C$87.56 on Friday, underperforming the broader Canadian market as the S&P/TSX Composite Index fell 0.03%. The company's stock closed 7.2% below its 52-week high of C$94.34, which was reached on March 30th."
20260424,Scorpio Tankers leads seven ocean transportation stocks with new Buy ratings at Jefferies,"Jefferies has initiated Buy ratings on seven marine transportation stocks, citing rising energy prices due to the war in Iran as a key driver for the sector's bullish sentiment. Among the favored stocks are International Seaways and Scorpio Tankers, noted for their strong balance sheets, strategic asset exposure, and attractive valuations. Geopolitical events are contributing to a tight supply environment, making the sector outlook appealing."
20260424,Bid-price warning and court ruling challenge SHF Holdings (NASDAQ: SHFS),"SHF Holdings (NASDAQ: SHFS) has received a Nasdaq warning for its stock trading below $1.00 for 30 consecutive business days, initiating a 180-day compliance period. Concurrently, a Colorado court denied the company's summary judgment motion in ongoing litigation concerning its Abaca acquisition, granting counterclaim plaintiffs' motions regarding a merger agreement breach, with damages yet to be determined. The company also announced board changes, including two new director appointments and an increase in total board seats."
20260424,"ADS-TEC Energy (NASDAQ: ADSE) revenue plunges, flags going-concern risk in H1 2025","ADS-TEC Energy (ADSE) reported a sharp decline in H1 2025 revenue, plunging to 14,614 kEUR from 79,263 kEUR due to weaker charging product sales, resulting in a net loss of 14,766 kEUR and negative operating cash flow. The company's management has expressed substantial doubt about its ability to continue as a going concern, despite securing new financing through convertible notes and warrant exercises. While liquidity has improved, the stressed capital structure with negative equity and high warrant liabilities signals ongoing financial instability."
20260424,A Look At Stride (LRN) Valuation After Ceasefire Relief And Strong Earnings Performance,"Stride (LRN) experienced an afternoon rally due to reduced geopolitical risk from an Iran ceasefire extension and strong earnings performance. While its current valuation narrative suggests it's 92.9% overvalued with a fair value of $51 against a $98.36 share price, its low 13x P/E ratio appears undervalued compared to the Consumer Services industry. The company's value proposition is tied to skills-based education beyond K-12, focusing on recurring demand for career-aligned programs and efficient scaling."
20260424,Sensient Technologies stock hits all-time high of 121.58 USD,"Sensient Technologies (SXT) stock reached an all-time high of $121.58, reflective of strong investor confidence and growth potential. The company's market capitalization stands at $5.17 billion, with the stock trading near its 52-week high, and it has maintained dividend payments for 56 consecutive years. Although an InvestingPro analysis suggests the stock is overvalued, the company recently surpassed analyst expectations for Q1 2026 earnings and revenue, demonstrating robust performance."
20260424,Stable trading for Vodafone stock as Indian GST tax demand and penalty issued,"Vodafone's stock is trading steadily despite a newly disclosed ₹16.4 lakh Indian GST tax demand for FY 2018-20, which the company plans to contest. The telecommunications giant is also expanding its cloud partnership with Google, focusing on AI and cybersecurity solutions for European and African SMEs, while its Indian subsidiary navigates regulatory clarity on adjusted gross revenue and minor tariff changes. Technical analysis suggests Vodafone's stock is in an upward channel, likely to consolidate between GBX 113.95 and GBX 116.50, with prevailing bullish sentiment tempered by overbought signals."
20260424,"Stock Market Today: SPY, QQQ Power to Record Highs ahead of Potential U.S.-Iran Talks in Islamabad","U.S. equities, including the S&P 500 ETF (SPY) and Nasdaq 100 ETF (QQQ), reached record highs on Friday. This surge occurred amidst news of potential U.S.-Iran negotiations, with special envoys dispatched to Islamabad, despite Iran denying intentions for direct talks. Several companies like Intel and AMD also saw significant gains following positive earnings and analyst upgrades."
20260424,Why ConocoPhillips (COP) Stock Is Trading Lower Today,"Shares of ConocoPhillips (COP) dropped 2.9% after crude oil prices eased due to signs of de-escalation in the Middle East, specifically a three-week ceasefire extension between Israel and Lebanon and reports of potential peace talks involving Iran. This news reduced concerns about supply disruptions, leading to lower oil prices and subsequently impacting the profitability and stock value of energy companies like ConocoPhillips. The stock closed down 2.2% at $121.66."
20260424,Is Merck & Co. (MRK) One of the Best Bear Market Stocks to Invest in Right Now?,"Merck & Co. (MRK) has partnered with Google Cloud in a multi-year, up to $1 billion investment to enhance its AI capabilities across various functions, aiming to digitize data and improve productivity. Despite Merck's inclusion in a list of top bear market stocks, the article suggests other AI stocks might offer higher returns in a shorter timeframe. Merck is a global healthcare company known for pharmaceuticals, vaccines, and animal health products."
20260424,Magnachip Semiconductor Corp. (MX) Stock Price Today & Analysis,"This article provides an analysis of Magnachip Semiconductor Corp. (MX) stock, including its fundamental financials, valuation metrics, and company overview. It also offers a guide on how to buy MX stock through the Gotrade app, explains minimum investment requirements, dividend policy, and safety measures. Additionally, the article gives insights into market hours and methods for assessing the stock's value."
20260424,Why Western Union (WU) Stock Is Trading Lower Today,"Western Union (WU) stock fell 3.4% today after the company reported disappointing first-quarter 2026 financial results, missing analyst expectations for earnings per share. Although revenue slightly beat projections, the adjusted EPS of $0.25 was significantly lower than the $0.39 consensus, leading to a 6 percentage point contraction in pre-tax profit margin. Despite the profit miss, management reiterated its full-year adjusted EPS guidance."
20260424,Assessing Nayax (TASE:NYAX) Valuation After NAMA 2026 Embedded Finance And AI Reveal,"Nayax (TASE:NYAX) is gaining attention after announcing its plans to showcase embedded finance features and AI tools at The NAMA Show 2026. Despite a strong recent performance and significant long-term reward for shareholders, Simply Wall St's analysis suggests Nayax is 18.9% overvalued, with a fair value of ₪166.49 compared to its current price of ₪197.9. The valuation is driven by expectations of brisk revenue expansion and rising margins, but potential risks include increased regulation and competition."
20260424,Freeport-McMoRan vs Ero Copper: Which Stock Could Rally?,"This article compares Freeport-McMoRan (FCX) and Ero Copper (ERO) stocks, suggesting ERO offers superior revenue growth, profitability, and valuation. ERO outperformed FCX in quarterly and last 12 months revenue growth, and also showed better operating margins and historical market performance. The analysis highlights key financial metrics and historical data to support the recommendation for ERO."
20260424,Is Walmart Inc. (WMT) One of the Best Performing Dow Stocks So Far in 2026?,"Walmart Inc. (WMT) is highlighted as one of the best-performing Dow stocks in 2026, driven by its redesign of the Great Value private label for 10,000 items to enhance visual consistency and nutrition information. The company also saw its Walmart+ membership grow to 28 million, up 12% year-on-year, and is undertaking extensive store renovations. Walmart projects $713 billion in revenue for fiscal year 2026, operating over 10,900 outlets globally."
20260424,JPMorgan Chase & Co. Issues Pessimistic Forecast for Tractor Supply (NASDAQ:TSCO) Stock Price,"JPMorgan Chase & Co. has lowered its price target for Tractor Supply (TSCO) from $55.00 to $48.00, maintaining a ""neutral"" rating, following the company's miss on Q1 earnings and revenue expectations. Several other firms also trimmed their price targets, contributing to a ""Moderate Buy"" average rating with a $49.08 target. Tractor Supply's stock experienced a selloff, hitting a one-year low, amid these analyst adjustments and recent insider selling activity totaling approximately $12 million."
20260424,Why (BJAN) Price Action Is Critical for Tactical Trading,"This article analyzes the Innovator U.s. Equity Buffer Etf - January (NASDAQ: BJAN), noting a near-term neutral sentiment amidst mid and long-term strength. It highlights an exceptional 8.0:1 risk-reward short setup and provides detailed institutional trading strategies, including position, momentum breakout, and risk hedging, along with multi-timeframe signal analysis. The piece, authored by the Quantitative Research Desk and edited by Thomas H. Kee Jr., emphasizes the importance of AI-generated signals for tactical trading decisions."
20260424,Trading Systems Reacting to (BNOV) Volatility,"Quantitative Research Desk reports on Innovator U.s. Equity Buffer Etf - November (NASDAQ: BNOV), highlighting a near-term neutral sentiment amidst mid and long-term strength. The analysis identifies a mid-channel oscillation pattern and an exceptional 9.6:1 risk-reward short setup. The article details specific trading strategies including position, momentum breakout, and risk hedging, along with multi-timeframe signal analysis."
20260424,"APA Corporation (APA) Stock Trades Down, Here Is Why","Shares of APA Corporation (APA), an oil and gas producer, fell 2.9% after crude oil prices dropped due to hopes of diplomatic progress between the US and Iran. As a result, WTI crude oil futures slipped to $94.8 per barrel, impacting APA’s financial performance which is closely tied to energy prices. This decline follows a previous drop related to a potential US-Iran ceasefire and a bearish IEA report forecasting a contraction in global oil demand."
20260424,"Brookfield Renewable Partners (TSE:BEP.UN) Stock Price Expected to Rise, Desjardins Analyst Says","Desjardins has raised its price target for Brookfield Renewable Partners (TSE:BEP.UN) from C$45.00 to C$48.00, maintaining a ""hold"" rating and suggesting a potential upside of 3.34%. Despite this positive outlook, the company faces profitability challenges with a negative net margin of 4.2% and high leverage, indicated by a debt-to-equity ratio of 107.8. Brookfield Renewable, which operates a globally diversified portfolio of clean energy assets, reported C$0.74 EPS for the quarter and has a market cap of C$14.21 billion."
20260424,Commodity Prices Are Soaring Again. Here Are 3 ETFs to Ride the Trend,"With inflation stubbornly above the Fed's target and significant volatility in energy prices, commodities are gaining investor interest. This article highlights three ETFs that offer distinct ways to gain exposure to the rising commodity prices: Invesco DB Agriculture Fund (DBA) for pure agricultural futures, WisdomTree Enhanced Commodity Strategy Fund (GCC) for broad, actively managed commodity exposure, and SPDR S&P Metals & Mining ETF (XME) for equity exposure to U.S. metals and mining companies. Each ETF caters to different investment objectives and tax considerations."
20260424,Alkami Technology Stock To $11?,"Alkami Technology (ALKT) stock has dropped by 10.6% recently, and Trefis predicts a further decline to $11, based on historical dip analysis and an ""Unattractive"" opinion of the stock. While historical data shows a median 12-month return of -22% after sharp dips, the company passes basic financial quality checks. Investors are advised to consider a portfolio approach rather than trying to time dips in individual stocks."
20260424,"ONMD Price Today: OneMedNet Corp. Stock Price, Quote & Chart | MEXC","OneMedNet Corp. (ONMD) is trading at $1.09, showing a 22.09% increase from its previous close, with a strong performance of +177.59% over the last 12 months. The company, classified in the SERVICES-COMMERCIAL PHYSICAL & BIOLOGICAL RESEARCH sector, specializes in digital medical image management and is listed on the NASDAQ exchange with a market capitalization of $56.84M. This article provides a detailed stock overview, market data, and an FAQ for potential investors."
20260424,Tractor Supply (NASDAQ:TSCO) Price Target Cut to $55.00 by Analysts at The Goldman Sachs Group,"The Goldman Sachs Group has reduced its price target for Tractor Supply (NASDAQ:TSCO) from $59.00 to $55.00, while maintaining a ""buy"" rating, indicating a potential upside of approximately 49% from its current price. This follows Tractor Supply's Q1 earnings miss, flat same-store sales, and a subsequent drop in stock price to a one-year low. Several other analysts have also lowered their price targets, and insiders have sold a significant number of shares recently."
20260424,Assessing OFG Bancorp (OFG) Valuation After Recent Share Price Momentum,"OFG Bancorp has seen significant share price momentum recently, with double-digit returns over the past month and three months. Despite trading near its average analyst price target, Simply Wall St's narrative suggests the stock is 4% overvalued at $46.10 with a fair value of $44.40, while their DCF model indicates it might be 58% undervalued with a target of $109.89. Investors are advised to consider both the overvaluation suggested by current earnings and the potential undervaluation hinted at by future cash flows, along with risks tied to its Puerto Rico concentration."
20260424,Nomura (NYSE:NMR) Trading Down 6.1% - Here's Why,"Nomura (NYSE:NMR) shares dropped 6.1% on Friday, trading at $7.765 with significantly reduced volume. This decline followed the company's Q4 earnings report, which missed EPS estimates ($0.18 vs. $0.24 expected) but beat revenue expectations ($3.52B vs. $3.25B). Despite mixed analyst sentiment, with a consensus ""Buy"" rating and a recent upgrade by JPMorgan Chase & Co., the stock trades at a P/E of 9.91 and has a high debt-to-equity ratio of 7.54."
20260424,Why NeoGenomics (NEO) Stock Is Trading Up Today,"NeoGenomics (NEO) stock rose 4.1% after announcing the integration of its oncology testing portfolio with the Epic Aura platform, a major electronic health record system. This integration aims to simplify test ordering and results viewing for physicians, potentially increasing test adoption by 20-30% per site. Despite today's positive movement, the stock has been volatile, dropping significantly over the last year due to disappointing earnings and trading well below its 52-week high."
20260424,"Power Integrations and Teradyne Stocks Trade Up, What You Need To Know","Power Integrations and Teradyne stocks rose following strong earnings from Intel and positive forecasts for the semiconductor sector. Intel's 22% growth in its data center business, driven by AI demand, boosted confidence across the industry, leading to gains for companies like AMD, Qualcomm, and ARM. Additionally, a research firm raised its semiconductor revenue forecast for 2026 due to surging AI-related demand, further fueling the market rally."
20260424,TTMI Stock Climbs As Stifel Hikes Price Target On AI And Defense Tailwinds,"TTM Technologies Inc. (TTMI) stock has climbed 10.9% following strong earnings and optimistic guidance. Stifel raised its price target from $108 to $135, reiterating a Buy rating due to tailwinds from AI infrastructure, defense modernization, and the semiconductor cycle. The article highlights TTMI's strong recent performance, financial soundness, and upcoming investor day and earnings call as key factors for traders, while also noting an insider share sale as a point for consideration."
20260424,A Look At National Fuel Gas (NFG) Valuation As Analyst Optimism Builds Ahead March 2026 Earnings,"National Fuel Gas (NFG) is attracting investor attention ahead of its March 2026 earnings, with analysts optimistic about its performance. The company is currently trading at $89.15, below the most-followed fair value estimate of $102, suggesting it might be undervalued based on its strong Marcellus Shale inventory and efficient production. However, a discounted cash flow model by Simply Wall St offers a lower fair value of $80.84, indicating a potential overvaluation by the market."
20260424,Entegris stock hits all-time high at 158.25 USD By Investing.com,"Entegris Inc. (ENTG) stock has reached an all-time high of $158.25, marking a 93.66% increase over the past year. This achievement follows strong fourth-quarter 2025 earnings, which surpassed analyst expectations for both EPS and revenue. Analysts from BMO Capital and KeyBanc Capital Markets have raised their price targets for Entegris, citing robust outlook and initial recovery."
20260424,GDV’s $1.80 annual payout faces a hidden test as leverage amplifies market risk,"The Gabelli Dividend & Income Trust (GDV) offers an annual payout of $1.80 per share, derived from portfolio dividends, capital gains, and return of capital. While the fund's top holdings are strong dividend payers, its leverage structure, including preferred share financing, amplifies market risk, especially with elevated Treasury yields. Investors buying GDV at its current all-time high face valuation risk and a narrowed discount to net asset value, despite strong historical performance and insider activity."
