date,title,summary
20260424,Jefferies initiates Capital Clean Energy Carriers stock at Hold,"Jefferies has initiated coverage on Capital Clean Energy Carriers Corp. (NASDAQ:CCEC) with a Hold rating and a price target of $20.00, citing LNG market softness. Despite the Hold rating, InvestingPro analysis suggests the company is undervalued, boasts impressive gross profit margins of 80.66%, and recently reported strong Q4 2025 earnings and a strategic vessel sale. Evercore ISI also raised its price target for CCEC to $27, maintaining an Outperform rating."
20260424,"B. Metzler seel. Sohn & Co. AG Purchases 4,623 Shares of Valero Energy Corporation $VLO","B. Metzler seel. Sohn & Co. AG increased its holdings in Valero Energy Corporation by 16.2% in the fourth quarter, purchasing an additional 4,623 shares and bringing its total to 33,189 shares valued at $5.403 million. Analysts have largely given positive outlooks, with several raising price targets and Zacks upgrading VLO to a ""strong-buy"" rating, anticipating an earnings beat. Despite strong institutional interest and positive analyst sentiment, one insider, SVP Eric A. Fisher, sold 400 shares of the company's stock."
20260424,55 North Private Wealth LLC Takes $1.26 Million Position in ExxonMobil Corporation $XOM,"55 North Private Wealth LLC initiated a new position in ExxonMobil Corporation, acquiring 10,495 shares valued at approximately $1.26 million during the fourth quarter. This move is part of broader institutional investor activity, with several major funds either increasing or reducing their stakes in XOM. Wall Street analysts currently hold a ""Moderate Buy"" consensus rating for ExxonMobil, with an average price target of $161.55."
20260424,Assessing Coterra Energy (CTRA) Valuation After Recent Share Price Moves,"Coterra Energy (CTRA) is currently experiencing mixed stock performance, with short-term pullbacks contrasting with significant long-term gains. Despite a recent share price of US$33.65, different valuation models present conflicting views; one narrative suggests the stock is 31.7% overvalued at a fair value of $25.55, while a discounted cash flow (DCF) model indicates it is undervalued with an estimated future cash flow value of $93.85. Investors are encouraged to review the underlying assumptions and risks of these models to make informed decisions."
20260424,Imperial Oil (IMO) to Release Quarterly Earnings on Friday,"Imperial Oil (IMO) is scheduled to release its Q1 2026 earnings before market open on Friday, May 1st, with analysts expecting $1.27 EPS and $6.3975 billion in revenue. The company recently increased its quarterly dividend to $0.87, representing an annualized yield of 2.7%. Imperial Oil currently holds an average analyst rating of ""Reduce"" with a consensus price target of $116.00."
20260424,"How Siemens Energy, A.H.T. Syngas, and Plug Power Are Capitalizing on the Iran Crisis—and How You Can Profit From It","The Iran crisis highlights the fragility of global energy flows, driving a shift towards energy independence. This article examines how Siemens Energy, A.H.T. Syngas, and Plug Power are capitalizing on this trend. Siemens Energy is seeing record orders for its gas business but faces challenges with its wind subsidiary, while A.H.T. Syngas is expanding its waste-to-energy projects in Poland and advancing green hydrogen technology. Plug Power is demonstrating an operational turnaround with improved margins and reduced cash burn, offering promising prospects for investors in the hydrogen economy."
20260424,Murphy USA stock hits 52-week high at 532.91 USD By Investing.com,"Murphy USA Inc. stock reached a new 52-week high of $532.91, reflecting a 29% year-to-date gain and a 38% surge over the past six months, although it is considered overvalued by InvestingPro. Recent positive analyst coverage and Q4 earnings have contributed to the stock's performance, with various firms adjusting price targets and ratings. The company recently appointed Donald R. Smith, Jr. as its new CFO."
20260424,Assessing SM Energy (SM) Valuation After Upbeat Analyst Outlook And Higher Earnings Estimates,"Recent analyst commentary on SM Energy (SM) has increased investor focus, with Wells Fargo projecting higher first-quarter production and Zacks noting significant positive revisions in earnings estimates. Despite a strong 90-day share price return, a traditional valuation narrative suggests SM Energy may be 2% overvalued at its current price of $29.29, compared to a fair value of $28.82. However, considering its P/E ratio of 10.8x against an industry average of 14.9x and a fair ratio of 22.4x, a different picture emerges, suggesting potential undervaluation or justified caution."
20260424,"Canadian Natural Resources Ltd. stock falls Friday, underperforms market","Canadian Natural Resources Ltd. (CNQ) stock fell by 2.44% on Friday, closing at C$60.69, underperforming the broader Canadian market. The S&P/TSX Composite Index also experienced a slight decline. The company's stock is currently 14.5% below its 52-week high of C$70.99, which was reached on March 30th."
20260424,Obsidian Energy (OTCMKTS:OBELF) Stock Price Up 10.8% - Still a Buy?,"Shares of Obsidian Energy Ltd. (OTCMKTS:OBELF) increased by 10.8% on Thursday, trading as high as $11.74 and closing at $11.70. This surge was accompanied by a significant increase in trading volume, with 2,944,088 shares changing hands, a 567% increase from the average. Despite the recent price jump, MarketBeat analysts currently have a Hold rating on Obsidian Energy and recommend five other stocks as better buys for clients."
20260424,Dow Should Benefit From Near-Term Commodity Chemicals Supply Chain Disruption in the Middle East,"The article discusses how Dow Inc. (DOW) is expected to benefit from near-term supply chain disruptions in commodity chemicals originating from the Middle East. It highlights Dow Chemical as one of the largest chemicals producers globally, with a history spanning over 125 years, focusing on commodity chemicals since its 2019 formation from the DowDuPont merger. The analysis by Morningstar analysts Seth Goldstein and Christian Fleming points to the potential positive impact on Dow's performance due to these geopolitical events."
20260424,Elon Musk vs. Plug Power Stock: Here's What the CEO of Tesla Thinks About Hydrogen Energy,"This article explores Elon Musk's views on hydrogen energy, particularly in relation to companies like Plug Power. Musk has repeatedly expressed skepticism about hydrogen fuel for transportation, favoring lithium-ion batteries. The piece also discusses the high cost of hydrogen fuel compared to traditional and other renewable energy sources, concluding that its widespread viability is years away and companies like Plug Power are reliant on government subsidies."
20260424,How Investors May Respond To Targa Resources (TRGP) 25% Dividend Hike Signaling Management Confidence,"Targa Resources Corp. recently increased its quarterly cash dividend by 25% to US$1.25 per share, signaling management's confidence in the business. This dividend hike comes alongside significant growth investments in Permian gas plants and NGL pipelines. Investors should consider how rising project costs and inflation might affect these expansions despite the positive signal from the increased dividend."
20260424,How Investors May Respond To Targa Resources (TRGP) 25% Dividend Hike Signaling Management Confidence,"Targa Resources Corp. has announced a 25% increase in its quarterly cash dividend to US$1.25 per share, signaling management's confidence in the company's business ahead of its upcoming earnings release. This dividend hike, consistent with previous guidance, aligns with Targa's significant growth investments in Permian gas plants and NGL pipelines. Investors, however, are encouraged to consider the potential impact of rising project costs and inflation on these expansions, as well as differing fair value estimates among the Simply Wall St Community."
20260424,The Railway and Telecom Stocks the Market's Writing Off Too Soon,This article discusses railway and telecom stocks that the market may be prematurely dismissing. It suggests these sectors could offer overlooked investment opportunities despite current sentiment.
20260423,Is It Too Late To Consider Imperial Oil (TSX:IMO) After Its Strong 1 Year Rally?,"This article analyzes Imperial Oil (TSX:IMO) after a significant one-year rally, using Discounted Cash Flow (DCF) and Price-to-Earnings (P/E) ratio approaches to assess its current valuation. While the DCF model suggests the stock is undervalued by 43.5%, the P/E ratio indicates it might be overvalued compared to industry averages and a proprietary ""Fair Ratio."" The analysis encourages investors to consider multiple valuation perspectives and company narratives."
20260423,Assessing Plains GP Holdings (PAGP) Valuation After Mixed Momentum And Conflicting Fair Value Signals,"Plains GP Holdings (PAGP) has shown mixed performance, with a recent decline but strong longer-term gains. Despite a common fair value estimate suggesting it's slightly overvalued, a Discounted Cash Flow model indicates significant undervaluation. The article highlights the importance of considering different valuation angles and future business developments, such as the planned divestiture of its NGL segment, to assess PAGP's investment potential."
20260423,NGL Energy Partners LP Hits New 52-Week High of $14.70,"NGL Energy Partners LP has reached a new 52-week high of $14.70, marking a 164.0% increase over the past year, significantly outperforming the S&P 500. The oil industry company boasts a market capitalization of $1,415 million and strong financial metrics, including a P/E ratio of 14.00 and a 16.69% return on equity, despite a high debt-to-equity ratio of 4.75. This achievement highlights the company's robust operational framework and evolving market position."
20260423,Is OGE Energy Corp (OGE) Overvalued After 3.2% Rally? GF Value S,"OGE Energy Corp shares rallied 3.2% to $47.53, but GuruFocus' GF Value™ indicates the stock is 9.6% overvalued with an intrinsic value of $43.35. Despite a moderate GF Score™ of 79/100, its current P/E of 20.6x is above its 5-year median, suggesting caution for new investors due to the lack of a margin of safety. Insider activity shows a balanced buying and selling, implying insiders are managing positions rather than making strong bets."
20260423,A Look At Mach Natural Resources (MNR) Valuation After Recent Mixed Share Price Performance,"Mach Natural Resources (MNR) has shown mixed share price performance recently, with short-term declines contrasting with positive longer-term returns. Despite this, the company is trading at a discount to analyst targets and its estimated intrinsic value of $18.57, suggesting it is undervalued based on the continued global reliance on oil and gas. Investors should consider the potential buying opportunity, weighing both rewards and warning signs, while also exploring other investment options that align with their risk and return preferences."
20260423,Seanergy Maritime Holdings Corp (SHIP) Suffers a Larger Drop Than the General Market: Key Insights,"Seanergy Maritime Holdings Corp (SHIP) recently saw a 1.12% drop, underperforming the S&P 500, Dow, and Nasdaq. Despite this, the stock has risen 12.23% over the past month, outpacing its sector and the S&P 500. The company anticipates strong earnings growth, with projected EPS up 237.04% and revenue up 75.18% year-over-year, and currently holds a Zacks Rank of #1 (Strong Buy)."
20260423,Oceaneering (NYSE: OII) posts Q1 2026 profit with weaker margins and cash outflow,"Oceaneering (NYSE: OII) reported Q1 2026 revenue of $692.4 million, an increase from the prior year, but net income decreased to $36.1 million from $50.4 million, with operating margin slipping from 11% to 8%. The company experienced a negative operating cash flow of $59.1 million, primarily due to working capital fluctuations typical of the early year, and its cash balance decreased to $607.5 million. The Energy segments showed mixed results, with Subsea Robotics and Manufactured Products performing well, while Aerospace and Defense Technologies saw revenue growth but reduced operating income due to a one-time accrual related to a contract dispute."
20260423,Vistra Marks Next Step in Acquisition of Gas Generation Fleet with Approval from the Federal Energy Regulatory Commission,"Vistra (NYSE: VST) has received Federal Energy Regulatory Commission (FERC) approval for its acquisition of seven natural gas generation facilities from Lotus Infrastructure Partners. This acquisition will add approximately 2,600 megawatts of capacity to Vistra's portfolio and is expected to close this quarter or Q1 2026. The transaction previously had its waiting period under the Hart-Scott-Rodino Act expire and now awaits approval from the New York Public Service Commission."
20260423,Oil States to post Q1 results before market open on May 5,"Oil States International, Inc. (NYSE: OIS) announced that its first quarter 2026 earnings conference call is scheduled for Tuesday, May 5, 2026, at 9:00 a.m. Central Daylight Time. The company expects to release its Q1 2026 results before the market opens on the same day. A webcast of the call will be available on Oil States’ website, and a replay will be accessible approximately two hours after its completion."
20260423,Jefferies lowers Vistra Energy stock price target on valuation By Investing.com,"Jefferies has lowered its price target for Vistra Energy (NYSE:VST) to $192 from $203, while maintaining a Buy rating, citing the company's valuation metrics as a compelling entry point. Despite the stock being down 30% since September 2025, it has delivered a 30.5% return over the past year. The firm believes the stock is not fully pricing in potential upside from future data center contracts, even with an overhang from ongoing PJM reform."
20260423,Crude Oil Moves Higher; AT&T Earnings Top Views,"U.S. stocks saw gains across major indices, with the Nasdaq Composite leading the way, while energy shares also performed well. AT&T Inc. reported strong first-quarter 2026 financial results, exceeding analyst expectations for both revenue and EPS. In commodity markets, crude oil, gold, and silver all traded higher."
20260423,Brava Energia: Ecopetrol notice regarding the acquisition of shares and tender offer,"BRAVA ENERGIA S.A. (""BRAVA"") has announced that it received a letter from Ecopetrol S.A. concerning the acquisition of BRAVA shares from certain shareholders, contingent on specific conditions. Ecopetrol also plans a voluntary public tender offer for additional BRAVA shares. BRAVA commits to keeping the market informed about these developments."
20260423,"Winter storms, diesel spike cut Marten Transport profit to $1.4M","Marten Transport reported a significant drop in Q1 2026 net income to $1.4 million ($0.02 diluted) from $4.3 million in Q1 2025, with operating revenue also falling by 8.8% to $203.5 million. The company attributed this decline to severe winter storms, a sharp spike in diesel prices, and a prolonged freight market recession. Despite these challenges, Marten Transport remains debt-free with $69.8 million in cash, supporting continued investment in its fleet and technology."
20260423,"Amplify Energy (NYSE: AMPY) outlines 2026 director elections, equity plan and say-on-pay votes","Amplify Energy Corp. details the proposals for its 2026 virtual annual meeting, scheduled for June 3, 2026. Key agenda items include the election of five directors, ratification of Grant Thornton LLP as the independent auditor, an advisory ""say-on-pay"" vote for executive compensation, approval of the 2024 Amended and Restated Equity Incentive Plan, and a vote on the frequency of future say-on-pay votes. The company highlights its corporate governance practices, executive compensation structure, and commitment to ESG initiatives."
20260423,What Genesis Energy (GEL)'s Payout and Revenue Beat Reveal About Its Gulf of Mexico Strategy,"Genesis Energy (GEL) recently announced quarterly cash distributions and reported revenue exceeding analyst expectations, driven by strong offshore pipeline volumes and improved marine transportation utilization. This performance highlights the importance of its Gulf of Mexico midstream network, reinforcing the company's investment narrative centered on the durability of its infrastructure and ability to generate steady cash flows, despite ongoing concerns about profitability and distribution coverage. The revenue beat acts as a short-term positive catalyst, yet larger challenges like balance sheet repair and legal issues still influence its investment outlook."
20260423,United Airlines Earnings: Premium Segment Should Help Weather Fuel Price Shock,"Morningstar has slightly decreased its fair value estimate for United Airlines stock to $95 per share from $98, despite the airline's premium customer segments being expected to help weather the impact of rising fuel prices. The airline reported increased revenue and operating profit in the first quarter of 2026, and its stable of less price-sensitive customers for premium seats and business bookings is anticipated to mitigate the effect of fare increases. United has also prudently decided to pare its prior capacity growth in response to the fuel price shock."
20260423,Is It Too Late To Consider Dominion Energy (D) After Its Recent 19.6% Share Price Gain?,"This article analyzes Dominion Energy (D) after its recent 19.6% share price increase, assessing whether it's still a good investment. Using Discounted Cash Flow (DCF) and Price-to-Earnings (P/E) ratio analyses, Simply Wall St suggests Dominion Energy is currently undervalued. The article also introduces a ""Narratives"" approach for investors to weigh different future scenarios for the company."
20260423,"Nvidia Shares Slide As Oil Spikes, Software Stocks Sell Off: What You Need To Know","Nvidia (NASDAQ: NVDA) shares dropped on Thursday amidst a broader market downturn, driven by rising oil prices and a sell-off in software stocks. The tech sector is experiencing a ""risk-off"" sentiment, with Nvidia also facing increased competition from AI chip startups. Despite strong underlying AI demand, chip leadership is fragmenting, causing investors to re-evaluate high-multiple growth stocks like Nvidia."
20260423,Why Does Warren Buffett Remain Bullish On Occidental Petroleum (OXY) Despite Its High Sensitivity To Oil?,"Warren Buffett remains bullish on Occidental Petroleum (OXY), significantly increasing Berkshire Hathaway's stake to $10.89 billion by Q4 2025. Despite the stock's high sensitivity to oil prices, as highlighted by Jim Cramer, OXY has demonstrated strong fundamentals including $4.3 billion in free cash flow, record production, and substantial cost reductions, making it attractive to investors anticipating an oil price rebound. The company's large resource base and improving balance sheet also contribute to its resilience and upside potential in a strengthening oil market."
20260423,Financial Markets Morning Commentary,"This morning commentary discusses minor movements in economic 10-year futures, yields, and S&P futures, despite increased vessel seizures in the Strait of Hormuz by Iran and interceptions by the US. The article details economic news including initial jobless claims, Tesla's Q1 revenue, and airline profit warnings due to high jet fuel costs, alongside geopolitical updates on the Strait of Hormuz, the US interception of Iranian oil tankers, and Russian wealth increases. Energy markets show mixed results for WTI and Brent crude, and metals markets react to geopolitical tensions."
20260423,First Solar Inc. stock underperforms Thursday when compared to competitors despite daily gains,"First Solar Inc. (FSLR) stock rose 3.96% on Thursday, closing at $196.19. Despite these daily gains, the stock underperformed compared to its competitors as the broader market, including the S&P 500 Index and Dow Jones Industrial Average, experienced declines. This marks the second consecutive day of gains for First Solar's stock."
20260423,Eversource Energy stock underperforms Thursday when compared to competitors despite daily gains,"Eversource Energy (ES) stock gained 2.57% on Thursday, closing at $68.77. Despite this daily gain, the stock underperformed compared to its competitors in an overall down market, with both the S&P 500 and Dow Jones Industrial Average experiencing declines. This marked the second consecutive day of gains for Eversource Energy."
20260423,Coterra Energy Inc. stock outperforms competitors on strong trading day,"Coterra Energy Inc. (CTRA) saw its stock rise by 2.19% to $33.65 on Thursday, outperforming the broader market which experienced declines. This marks the fourth consecutive day of gains for the company, despite the S&P 500 and Dow Jones Industrial Average both falling."
20260423,Occidental vs. ConocoPhillips: Which Energy Stock Has More Upside?,"This article compares Occidental Petroleum (OXY) and ConocoPhillips (COP), two leading energy stocks, to determine which offers more upside potential. While both are strong companies benefiting from the current energy market, ConocoPhillips is presented as the better investment due to its superior Return on Equity, lower debt, higher dividend yield, better price performance, and larger capital expenditure plans, despite Occidental's stronger short-term earnings estimate revision. Both stocks currently hold a Zacks Rank #1 (Strong Buy)."
20260423,CenterPoint Energy Inc. stock outperforms competitors on strong trading day,"CenterPoint Energy Inc. (CNP) saw its stock price increase by 2.52% to $43.18 on Thursday, defying a general market downturn. This rise ended a four-day losing streak for the company, as both the S&P 500 Index and Dow Jones Industrial Average experienced declines."
20260423,Devon Energy Corp. stock outperforms competitors on strong trading day,"Devon Energy Corp. (DVN) saw its stock rise by 2.19% to $48.15 on Thursday, even as the broader market, including the S&P 500 Index and Dow Jones Industrial Average, experienced declines. This marks the fourth consecutive day of gains for the company's stock. The article highlights DVN's strong performance relative to its competitors during a generally negative trading session."
20260423,Ameren Corp. stock outperforms competitors on strong trading day,"Ameren Corp. (AEE) saw its stock increase by 2.57% to $112.05 on Thursday, bucking the downward trend of the broader market. This strong performance occurred on a day when both the S&P 500 Index and the Dow Jones Industrial Average experienced declines. The stock's rise ended a three-day losing streak for Ameren Corp."
20260423,Atmos Energy Corp. stock outperforms competitors on strong trading day,"Atmos Energy Corp. (ATO) shares rose 2.92% to $187.81 on Thursday, outperforming the S&P 500 Index and Dow Jones Industrial Average, both of which declined. This gain broke a four-day losing streak for the stock. The article specifically highlights ATO's performance in a generally down market."
20260423,NRG Energy Inc. stock outperforms competitors on strong trading day,"NRG Energy Inc. (NRG) saw its stock rise by 3.30% to $154.53 on Thursday, despite a generally poor trading session for the broader market. This increase broke a four-day losing streak for the company. The S&P 500 Index and Dow Jones Industrial Average both experienced declines on the same day."
20260423,Targa Resources Corp. stock outperforms competitors on strong trading day,"Shares of Targa Resources Corp. (TRGP) rose 1.34% to $239.91 on Thursday, outperforming the broader stock market which saw declines in both the S&P 500 Index and the Dow Jones Industrial Average. This marks the third consecutive day of gains for the stock."
20260423,Paccar Inc. stock outperforms competitors on strong trading day,"Paccar Inc. (PCAR) stock rose 1.36% to $126.97 on Thursday, outperforming the broader market during a tough trading session where the S&P 500 and Dow Jones Industrial Average both declined. This gain ended a two-day losing streak for the company's shares."
20260423,American Electric Power Co. Inc. stock underperforms Thursday when compared to competitors despite daily gains,"American Electric Power Co. Inc. (AEP) stock rose 2.63% on Thursday to $135.08, breaking a four-day losing streak, despite a broader market downturn with the S&P 500 and Dow Jones Industrial Average both falling. The company's stock, however, still underperformed compared to its competitors. This daily gain occurred on an otherwise dismal trading day for the stock market."
20260423,BP suffers heavy defeat in investor climate vote,"BP faced significant investor backlash at its annual meeting as two resolutions aimed at reducing climate reporting requirements and allowing electronic-only meetings failed to pass. Shareholders also registered a notable protest against new chair Albert Manifold, with over 18% voting against his election due to governance concerns. This signals investor demand for greater transparency regarding BP's climate strategy and capital expenditure on oil and gas."
20260423,"EU: Leadership shift brings operational focus, M&A drive, and steady uranium market outlook","enCore Energy Corp. (EU) is experiencing a leadership transition, with a new CEO emphasizing operational efficiency, responsible growth, and potential M&A. The company anticipates active drilling and permitting updates, notes robust contracting activity, and is benefiting from increased government support for uranium production, indicating a steady uranium market outlook."
